{
  "schemaVersion": 1,
  "id": "explain.queue-enqueue",
  "title": "队列入队：从点击到本地状态",
  "description": "演示一个状态单元如何把动作变成可回放、可清除的本地队列状态。",
  "model": { "kind": "queue" },
  "actions": [
    { "id": "advance", "type": "advance", "label": "下一步" },
    { "id": "reset", "type": "reset", "label": "重置" },
    { "id": "inspect", "type": "inspect", "label": "查看状态" }
  ],
  "views": [
    { "id": "event", "kind": "event", "label": "用户动作" },
    { "id": "state", "kind": "state", "label": "队列状态" },
    { "id": "result", "kind": "result", "label": "持久化结果" }
  ],
  "controls": { "step": "按步骤查看队列变化", "reset": "回到未入队状态" },
  "annotations": ["动作只在浏览器本地执行", "IndexedDB 不可用时退回内存"],
  "steps": [
    { "id": "capture", "title": "捕获动作", "text": "用户点击入队，任务壳记录 enqueue 动作。", "annotation": "不会上传输入或状态。" },
    { "id": "transition", "title": "计算转移", "text": "纯状态转移把一个项目追加到队列末尾。", "annotation": "同一状态可被重放。" },
    { "id": "persist", "title": "保存并反馈", "text": "结果保存到本站 IndexedDB，并通过状态区播报。", "annotation": "清除本站数据不会影响文章。" }
  ],
  "staticFallback": {
    "summary": "队列动作依次经过捕获、状态转移和本地持久化三个阶段。",
    "steps": ["捕获 enqueue 动作", "追加队列项目", "保存到本站本地存储"]
  },
  "accessibility": {
    "instructions": "使用 Tab 聚焦按钮，按 Enter 或空格逐步播放；当前步骤会在状态区播报。",
    "liveRegion": "当前解释步骤"
  }
}
